diff --git a/lib/widgets/home.dart b/lib/widgets/home.dart
index 9a0850e0b9..88d3bf5d2e 100644
--- a/lib/widgets/home.dart
+++ b/lib/widgets/home.dart
@@ -148,40 +148,6 @@ class _HomePageState extends State<HomePage> {
   }
 }
 
-/// A "no content here" message, for the Inbox, Subscriptions, and DMs pages.
-///
-/// This should go near the root of the "page body"'s widget subtree.
-/// In particular, it handles the horizontal device insets.
-/// (The vertical insets are handled externally, by the app bar and bottom nav.)
-class PageBodyEmptyContentPlaceholder extends StatelessWidget {
-  const PageBodyEmptyContentPlaceholder({super.key, required this.message});
-
-  final String message;
-
-  @override
-  Widget build(BuildContext context) {
-    final designVariables = DesignVariables.of(context);
-
-    return SafeArea(
-      minimum: EdgeInsets.symmetric(horizontal: 24),
-      child: Padding(
-        padding: EdgeInsets.only(top: 48, bottom: 16),
-        child: Align(
-          alignment: Alignment.topCenter,
-          // TODO leading and trailing elements, like in Figma (given as SVGs):
-          //   https://www.figma.com/design/1JTNtYo9memgW7vV6d0ygq/Zulip-Mobile?node-id=5957-167736&m=dev
-          child: Text(
-            textAlign: TextAlign.center,
-            style: TextStyle(
-              color: designVariables.labelSearchPrompt,
-              fontSize: 17,
-              height: 23 / 17,
-            ).merge(weightVariableTextStyle(context, wght: 500)),
-            message))));
-  }
-}
-
-
 const kTryAnotherAccountWaitPeriod = Duration(seconds: 5);
 
 class _LoadingPlaceholderPage extends StatefulWidget {
diff --git a/lib/widgets/inbox.dart b/lib/widgets/inbox.dart
index 7f101a81ce..d00cabb9dc 100644
--- a/lib/widgets/inbox.dart
+++ b/lib/widgets/inbox.dart
@@ -6,9 +6,9 @@ import '../model/narrow.dart';
 import '../model/recent_dm_conversations.dart';
 import '../model/unreads.dart';
 import 'action_sheet.dart';
-import 'home.dart';
 import 'icons.dart';
 import 'message_list.dart';
+import 'page.dart';
 import 'sticky_header.dart';
 import 'store.dart';
 import 'text.dart';
diff --git a/lib/widgets/page.dart b/lib/widgets/page.dart
index a2c6fe52a1..d935e91d4d 100644
--- a/lib/widgets/page.dart
+++ b/lib/widgets/page.dart
@@ -2,6 +2,8 @@
 import 'package:flutter/material.dart';
 
 import 'store.dart';
+import 'text.dart';
+import 'theme.dart';
 
 /// An [InheritedWidget] for near the root of a page's widget subtree,
 /// providing its [BuildContext].
@@ -210,3 +212,36 @@ class LoadingPlaceholderPage extends StatelessWidget {
     );
   }
 }
+
+/// A "no content here" message, for the Inbox, Subscriptions, and DMs pages.
+///
+/// This should go near the root of the "page body"'s widget subtree.
+/// In particular, it handles the horizontal device insets.
+/// (The vertical insets are handled externally, by the app bar and bottom nav.)
+class PageBodyEmptyContentPlaceholder extends StatelessWidget {
+  const PageBodyEmptyContentPlaceholder({super.key, required this.message});
+
+  final String message;
+
+  @override
+  Widget build(BuildContext context) {
+    final designVariables = DesignVariables.of(context);
+
+    return SafeArea(
+      minimum: EdgeInsets.symmetric(horizontal: 24),
+      child: Padding(
+        padding: EdgeInsets.only(top: 48, bottom: 16),
+        child: Align(
+          alignment: Alignment.topCenter,
+          // TODO leading and trailing elements, like in Figma (given as SVGs):
+          //   https://www.figma.com/design/1JTNtYo9memgW7vV6d0ygq/Zulip-Mobile?node-id=5957-167736&m=dev
+          child: Text(
+            textAlign: TextAlign.center,
+            style: TextStyle(
+              color: designVariables.labelSearchPrompt,
+              fontSize: 17,
+              height: 23 / 17,
+            ).merge(weightVariableTextStyle(context, wght: 500)),
+            message))));
+  }
+}
diff --git a/lib/widgets/recent_dm_conversations.dart b/lib/widgets/recent_dm_conversations.dart
index 5758a39d76..97c53ac4b1 100644
--- a/lib/widgets/recent_dm_conversations.dart
+++ b/lib/widgets/recent_dm_conversations.dart
@@ -5,10 +5,10 @@ import '../model/narrow.dart';
 import '../model/recent_dm_conversations.dart';
 import '../model/unreads.dart';
 import 'content.dart';
-import 'home.dart';
 import 'icons.dart';
 import 'message_list.dart';
 import 'new_dm_sheet.dart';
+import 'page.dart';
 import 'store.dart';
 import 'text.dart';
 import 'theme.dart';
diff --git a/lib/widgets/subscription_list.dart b/lib/widgets/subscription_list.dart
index 8a7bd9b9b5..ff3db94391 100644
--- a/lib/widgets/subscription_list.dart
+++ b/lib/widgets/subscription_list.dart
@@ -5,9 +5,9 @@ import '../generated/l10n/zulip_localizations.dart';
 import '../model/narrow.dart';
 import '../model/unreads.dart';
 import 'action_sheet.dart';
-import 'home.dart';
 import 'icons.dart';
 import 'message_list.dart';
+import 'page.dart';
 import 'store.dart';
 import 'text.dart';
 import 'theme.dart';
