diff --git a/app/build.gradle b/app/build.gradle
index e8d11dfef18..fe901dc6449 100644
--- a/app/build.gradle
+++ b/app/build.gradle
@@ -216,6 +216,7 @@ task downloadPresets {
 static def bcp47LanguageTagToJavaLanguageTag(String bcp47) {
     def locale = Locale.forLanguageTag(bcp47)
     def result = locale.language
+    if (!locale.script.isEmpty()) result += "-" + locale.script
     if (!locale.country.isEmpty()) result += "-" + locale.country
     return result
 }
@@ -256,19 +257,26 @@ static def unescapeUnicode(String str) {
     return out.toString()
 }
 
+static def javaLanguageTagToAndroidResCode(String languageTag) {
+    def locale = Locale.forLanguageTag(languageTag)
+    // scripts not supported by Android resource system
+    if (!locale.script.isEmpty()) return []
+
+    if (languageTag == "nb")    return ["no", "nb"]
+    if (languageTag == "zh-CN") return ["zh"]
+    def withCountry = (~/^([a-z]{2,3})-([A-Z]{2})$/).matcher(languageTag)
+    if (withCountry.matches()) {
+        return [withCountry.group(1) + "-r" + withCountry.group(2)]
+    }
+    return [languageTag]
+}
+
 task pullTranslations {
     doLast {
         def baseUrl = "https://api.poeditor.com/v2"
         def baseParams = "api_token=$POEditorAPIToken&id=97843"
         def exportLanguages = bcp47ExportLanguages.collect { it.toLowerCase(Locale.US) }
         exportLanguages.remove("en") // don't export en, it is the source language
-        def languageToAndroidResCodes = [
-                "nb": ["no", "nb"],
-                "zh-CN": ["zh"],
-                "en-GB": ["en-rGB"],
-                "pt-BR": ["pt-rBR"],
-                "zh-TW": ["zh-rTW"]
-        ]
 
         def languageListConnection = new URL("$baseUrl/languages/list").openConnection()
         def languageCodeToPercentage = []
@@ -283,6 +291,23 @@ task pullTranslations {
         }
 
         languageCodeToPercentage.each { language, percentage ->
+            def javaLanguageTag = bcp47LanguageTagToJavaLanguageTag(language)
+            def androidResCodes = javaLanguageTagToAndroidResCode(javaLanguageTag)
+
+            for (androidResCode in androidResCodes) {
+                // exclude default translation
+                if (androidResCode == "en-rUS") continue
+                def targetFile = new File("app/src/main/res/values-$androidResCode/translation_info.xml")
+                new File(targetFile.getParent()).mkdirs()
+                targetFile.newWriter().withWriter { it << """\
+                    <?xml version="1.0" encoding="utf-8"?>
+                    <resources>
+                      <integer name="translation_completeness">$percentage</integer>
+                    </resources>
+                    """.stripIndent()
+                }
+            }
+
             if (!exportLanguages.contains(language.toLowerCase())) {
                 println("$language (translated $percentage%) SKIPPED")
             } else {
@@ -299,8 +324,6 @@ task pullTranslations {
                     fileUrl = new JsonSlurper().parse(inputStream).result.url
                 }
 
-                def javaLanguageTag = bcp47LanguageTagToJavaLanguageTag(language)
-                def androidResCodes = languageToAndroidResCodes[javaLanguageTag] ?: [javaLanguageTag]
                 def text = new URL(fileUrl).openStream().getText()
                 for (androidResCode in androidResCodes) {
                     def targetFile = "app/src/main/res/values-$androidResCode/strings.xml"
diff --git a/app/src/main/java/de/westnordost/streetcomplete/about/AboutFragment.kt b/app/src/main/java/de/westnordost/streetcomplete/about/AboutFragment.kt
index 41ab6b7f69e..d1592c3387e 100644
--- a/app/src/main/java/de/westnordost/streetcomplete/about/AboutFragment.kt
+++ b/app/src/main/java/de/westnordost/streetcomplete/about/AboutFragment.kt
@@ -18,6 +18,7 @@ import de.westnordost.streetcomplete.BuildConfig
 import de.westnordost.streetcomplete.R
 import de.westnordost.streetcomplete.view.ListAdapter
 import kotlinx.android.synthetic.main.cell_labeled_icon_select_right.view.*
+import java.util.*
 
 /** Shows the about screen */
 class AboutFragment : PreferenceFragmentCompat() {
@@ -56,6 +57,15 @@ class AboutFragment : PreferenceFragmentCompat() {
             openUrl("https://github.com/westnordost/StreetComplete/")
         }
 
+        findPreference<Preference>("translate")?.summary = resources.getString(
+            R.string.about_description_translate,
+            Locale.getDefault().displayLanguage,
+            resources.getInteger(R.integer.translation_completeness)
+        )
+        findPreference<Preference>("translate")?.setOnPreferenceClickListener {
+            openUrl("https://poeditor.com/join/project/IE4GC127Ki")
+        }
+
         findPreference<Preference>("report_error")?.setOnPreferenceClickListener {
             openUrl("https://github.com/westnordost/StreetComplete/issues/")
         }
diff --git a/app/src/main/res/values-ar/translation_info.xml b/app/src/main/res/values-ar/translation_info.xml
new file mode 100644
index 00000000000..ee10fb08ec3
--- /dev/null
+++ b/app/src/main/res/values-ar/translation_info.xml
@@ -0,0 +1,4 @@
+<?xml version="1.0" encoding="utf-8"?>
+<resources>
+  <integer name="translation_completeness">27</integer>
+</resources>
diff --git a/app/src/main/res/values-ast/translation_info.xml b/app/src/main/res/values-ast/translation_info.xml
new file mode 100644
index 00000000000..7c792a90e78
--- /dev/null
+++ b/app/src/main/res/values-ast/translation_info.xml
@@ -0,0 +1,4 @@
+<?xml version="1.0" encoding="utf-8"?>
+<resources>
+  <integer name="translation_completeness">69</integer>
+</resources>
diff --git a/app/src/main/res/values-be/translation_info.xml b/app/src/main/res/values-be/translation_info.xml
new file mode 100644
index 00000000000..0fc794a37a1
--- /dev/null
+++ b/app/src/main/res/values-be/translation_info.xml
@@ -0,0 +1,4 @@
+<?xml version="1.0" encoding="utf-8"?>
+<resources>
+  <integer name="translation_completeness">11</integer>
+</resources>
diff --git a/app/src/main/res/values-bn/translation_info.xml b/app/src/main/res/values-bn/translation_info.xml
new file mode 100644
index 00000000000..23ab843ad1b
--- /dev/null
+++ b/app/src/main/res/values-bn/translation_info.xml
@@ -0,0 +1,4 @@
+<?xml version="1.0" encoding="utf-8"?>
+<resources>
+  <integer name="translation_completeness">2</integer>
+</resources>
diff --git a/app/src/main/res/values-ca/translation_info.xml b/app/src/main/res/values-ca/translation_info.xml
new file mode 100644
index 00000000000..de1c58d338e
--- /dev/null
+++ b/app/src/main/res/values-ca/translation_info.xml
@@ -0,0 +1,4 @@
+<?xml version="1.0" encoding="utf-8"?>
+<resources>
+  <integer name="translation_completeness">81</integer>
+</resources>
diff --git a/app/src/main/res/values-cs/strings.xml b/app/src/main/res/values-cs/strings.xml
index cf9eb7f2bcd..a0757c0d36d 100644
--- a/app/src/main/res/values-cs/strings.xml
+++ b/app/src/main/res/values-cs/strings.xml
@@ -1861,6 +1861,8 @@ Chcete cestu rozdělit?"</string>
 
     <!-- Fuzzy -->
     <string name="quest_ref_answer_noRef">"Není tu žádné referenční číslo..."</string>
+
+    <!-- Fuzzy -->
     <string name="quest_street_side_puzzle_tutorial">"Cesta na ilustraci je otočená stejně jako na mapě v místě označení."</string>
 
     <!-- Fuzzy -->
@@ -2362,6 +2364,10 @@ It is not big issue, but it would be nice to have it correctly. -->
     <string name="quest_openingHours_add_off_days">"Přidat dny, kdy je zavřeno"</string>
     <string name="quest_openingHours_off_day">"Zavřeno"</string>
     <string name="quest_openingHours_unspecified_range">"Neurčeno"</string>
+
+    <!-- Could this be translated as: 
+Is the situation on this cycleway still the same? -->
+    <string name="quest_cycleway_resurvey_title">"Je to zde stále aktulální situace cyklostezky?"</string>
     <string name="quest_wheelchairAccess_name_type_title">"Má %1$s (%2$s) bezbariérový přístup?"</string>
     <string name="pref_title_resurvey_intervals">"Intervaly pro ověřování"</string>
     <string name="resurvey_intervals_less_often">"Ptát se méně často"</string>
@@ -2369,4 +2375,11 @@ It is not big issue, but it would be nice to have it correctly. -->
     <string name="resurvey_intervals_more_often">"Ptát se častěji"</string>
     <string name="quest_street_side_puzzle_select">"Vyberte ťuknutím"</string>
     <string name="quest_accepts_cash_type_title">"Přijímá %1$s (%2$s) platbu v hotovosti?"</string>
+    <string name="quest_busStopBench_tram_name_title">"Má tramvajová zastávka %s lavičku?"</string>
+    <string name="quest_busStopBench_tram_title">"Má tato tramvajová zastávka lavičku?"</string>
+    <string name="quest_busStopBench_title">"Má tato autobusová zastávka lavičku?"</string>
+    <string name="quest_busStopBench_name_title">"Má autobusová zastávka %s lavičku?"</string>
+    <string name="quest_summit_register_title">"Je na %s vrcholová kniha?"</string>
+    <string name="quest_is_defibrillator_inside_title">"Je tento defibrilátor (AED) uvnitř budovy?"</string>
+    <string name="dialog_tutorial_download">"Při vypnuté automatické synchronizaci se úkoly nestahují automaticky. Pro jejich manuální stažení použijte v nabídce tlačítko „%s“ na místě, na kterém chcete úkoly stáhnout."</string>
 </resources>
\ No newline at end of file
diff --git a/app/src/main/res/values-cs/translation_info.xml b/app/src/main/res/values-cs/translation_info.xml
new file mode 100644
index 00000000000..1953c600c12
--- /dev/null
+++ b/app/src/main/res/values-cs/translation_info.xml
@@ -0,0 +1,4 @@
+<?xml version="1.0" encoding="utf-8"?>
+<resources>
+  <integer name="translation_completeness">100</integer>
+</resources>
diff --git a/app/src/main/res/values-cy/translation_info.xml b/app/src/main/res/values-cy/translation_info.xml
new file mode 100644
index 00000000000..1382aea1481
--- /dev/null
+++ b/app/src/main/res/values-cy/translation_info.xml
@@ -0,0 +1,4 @@
+<?xml version="1.0" encoding="utf-8"?>
+<resources>
+  <integer name="translation_completeness">15</integer>
+</resources>
diff --git a/app/src/main/res/values-da/translation_info.xml b/app/src/main/res/values-da/translation_info.xml
new file mode 100644
index 00000000000..de1c58d338e
--- /dev/null
+++ b/app/src/main/res/values-da/translation_info.xml
@@ -0,0 +1,4 @@
+<?xml version="1.0" encoding="utf-8"?>
+<resources>
+  <integer name="translation_completeness">81</integer>
+</resources>
diff --git a/app/src/main/res/values-de/strings.xml b/app/src/main/res/values-de/strings.xml
index 07205248dc0..abdf18658ef 100644
--- a/app/src/main/res/values-de/strings.xml
+++ b/app/src/main/res/values-de/strings.xml
@@ -678,8 +678,6 @@ Jetzt aufspalten?"</string>
     <string name="quest_postboxRef_title">"Was ist die Referenznummer dieses Briefkastens?"</string>
     <string name="quest_postboxRef_name_title">"Was ist die Referenznummer dieses %s Briefkastens?"</string>
     <string name="quest_ref_answer_noRef">"Keine Referenznummer sichtbar…"</string>
-
-    <!-- Fuzzy -->
     <string name="quest_street_side_puzzle_tutorial">"Die Straße auf der Abbildung ist genauso gedreht wie auf der Karte an der Position des Pins."</string>
     <string name="quest_recycling_materials_title">"Was kann hier entsorgt werden?"</string>
     <string name="quest_recycling_materials_note">"Wenn noch Anderes entsorgt werden kann als man hier angeben kann, bitte hinterlasse stattdessen eine Notiz."</string>
@@ -875,11 +873,28 @@ Erfolge"</string>
     <string name="quest_oneway_tutorial">"Die Straße auf der Abbildung ist genauso gedreht wie auf der Karte an der Position des Pins. Beachte die gezeigte Richtung."</string>
     <string name="at_housename">"Hausname %s:"</string>
     <string name="at_conscription_and_street_number">"Konskriptionsnummer %1$s, Orientierungsnummer %2$s:"</string>
-
-    <!-- Fuzzy -->
     <string name="at_conscription_number">"Konskriptionsnummer %s:"</string>
     <string name="at_housenumber">"Hausnummer %s:"</string>
     <string name="quest_openingHours_name_type_title">"Was sind die Öffnungszeiten von %1$s (%2$s)?"</string>
+    <string name="quest_openingHours_resurvey_name_title">"Stimmen diese Öffnungszeiten für %s immer noch?"</string>
+    <string name="quest_openingHours_resurvey_name_type_title">"Stimmen diese Öffnungszeiten für %1$s (%2$s) noch?"</string>
+    <string name="quest_openingHours_resurvey_no_name_title">"Stimmen diese Öffnungszeiten noch  (%s)?"</string>
+    <string name="quest_openingHours_add_off_days">"Neuer Ruhetag"</string>
+    <string name="quest_openingHours_off_day">"Ruhetag"</string>
+    <string name="quest_openingHours_unspecified_range">"Nicht angegeben"</string>
+    <string name="quest_cycleway_resurvey_title">"Sind die Radwege immer noch so?"</string>
     <string name="quest_wheelchairAccess_name_type_title">"Ist %1$s (%2$s) zugänglich für Rollstühle?"</string>
+    <string name="pref_title_resurvey_intervals">"Überprüfungsintervalle"</string>
+    <string name="resurvey_intervals_less_often">"Seltener fragen"</string>
+    <string name="resurvey_intervals_default">"Standard"</string>
+    <string name="resurvey_intervals_more_often">"Öfter fragen"</string>
+    <string name="quest_street_side_puzzle_select">"Antippen zum Auswählen"</string>
     <string name="quest_accepts_cash_type_title">"Akzeptiert %1$s (%2$s) Bargeld?"</string>
+    <string name="quest_busStopBench_tram_name_title">"Hat die Straßenbahnhaltestelle %s eine Bank?"</string>
+    <string name="quest_busStopBench_tram_title">"Hat diese Straßenbahnhaltestelle eine Bank?"</string>
+    <string name="quest_busStopBench_title">"Hat diese Bushaltestelle eine Bank?"</string>
+    <string name="quest_busStopBench_name_title">"Hat die Haltestelle %s eine Bank?"</string>
+    <string name="quest_summit_register_title">"Gibt es bei %s ein Gipfelbuch?"</string>
+    <string name="quest_is_defibrillator_inside_title">"Befindet sich dieser Defibrillator innerhalb eines Gebäudes?"</string>
+    <string name="dialog_tutorial_download">"Wenn Auto-Sync aus ist werden Aufgaben nicht automatisch heruntergeladen. Um dies manuell zu tun, benutze den \"%s\" Knopf im Menü an der Stelle an der Du sie herunterladen möchtest."</string>
 </resources>
\ No newline at end of file
diff --git a/app/src/main/res/values-de/translation_info.xml b/app/src/main/res/values-de/translation_info.xml
new file mode 100644
index 00000000000..1953c600c12
--- /dev/null
+++ b/app/src/main/res/values-de/translation_info.xml
@@ -0,0 +1,4 @@
+<?xml version="1.0" encoding="utf-8"?>
+<resources>
+  <integer name="translation_completeness">100</integer>
+</resources>
diff --git a/app/src/main/res/values-el/translation_info.xml b/app/src/main/res/values-el/translation_info.xml
new file mode 100644
index 00000000000..c5c5d3a62e8
--- /dev/null
+++ b/app/src/main/res/values-el/translation_info.xml
@@ -0,0 +1,4 @@
+<?xml version="1.0" encoding="utf-8"?>
+<resources>
+  <integer name="translation_completeness">78</integer>
+</resources>
diff --git a/app/src/main/res/values-en-rGB/translation_info.xml b/app/src/main/res/values-en-rGB/translation_info.xml
new file mode 100644
index 00000000000..b7c528aced7
--- /dev/null
+++ b/app/src/main/res/values-en-rGB/translation_info.xml
@@ -0,0 +1,4 @@
+<?xml version="1.0" encoding="utf-8"?>
+<resources>
+  <integer name="translation_completeness">74</integer>
+</resources>
diff --git a/app/src/main/res/values-en/translation_info.xml b/app/src/main/res/values-en/translation_info.xml
new file mode 100644
index 00000000000..1953c600c12
--- /dev/null
+++ b/app/src/main/res/values-en/translation_info.xml
@@ -0,0 +1,4 @@
+<?xml version="1.0" encoding="utf-8"?>
+<resources>
+  <integer name="translation_completeness">100</integer>
+</resources>
diff --git a/app/src/main/res/values-eo/translation_info.xml b/app/src/main/res/values-eo/translation_info.xml
new file mode 100644
index 00000000000..b1cd140a303
--- /dev/null
+++ b/app/src/main/res/values-eo/translation_info.xml
@@ -0,0 +1,4 @@
+<?xml version="1.0" encoding="utf-8"?>
+<resources>
+  <integer name="translation_completeness">58</integer>
+</resources>
diff --git a/app/src/main/res/values-es/translation_info.xml b/app/src/main/res/values-es/translation_info.xml
new file mode 100644
index 00000000000..5b0ce213bb3
--- /dev/null
+++ b/app/src/main/res/values-es/translation_info.xml
@@ -0,0 +1,4 @@
+<?xml version="1.0" encoding="utf-8"?>
+<resources>
+  <integer name="translation_completeness">97</integer>
+</resources>
diff --git a/app/src/main/res/values-et/translation_info.xml b/app/src/main/res/values-et/translation_info.xml
new file mode 100644
index 00000000000..32f6b90ccad
--- /dev/null
+++ b/app/src/main/res/values-et/translation_info.xml
@@ -0,0 +1,4 @@
+<?xml version="1.0" encoding="utf-8"?>
+<resources>
+  <integer name="translation_completeness">41</integer>
+</resources>
diff --git a/app/src/main/res/values-eu/translation_info.xml b/app/src/main/res/values-eu/translation_info.xml
new file mode 100644
index 00000000000..12ea8c76bab
--- /dev/null
+++ b/app/src/main/res/values-eu/translation_info.xml
@@ -0,0 +1,4 @@
+<?xml version="1.0" encoding="utf-8"?>
+<resources>
+  <integer name="translation_completeness">91</integer>
+</resources>
diff --git a/app/src/main/res/values-fa/strings.xml b/app/src/main/res/values-fa/strings.xml
index dea1e2ef8c7..a29be3c9dc6 100644
--- a/app/src/main/res/values-fa/strings.xml
+++ b/app/src/main/res/values-fa/strings.xml
@@ -19,14 +19,8 @@
     <string name="quest_generic_answer_notApplicable">"نمی‌توان اظهار نظر کرد…"</string>
     <string name="quest_generic_confirmation_title">"شما مطمئن هستید؟"</string>
     <string name="quest_generic_confirmation_yes">"بله مطمئنم"</string>
-
-    <!-- Fuzzy -->
     <string name="quest_generic_confirmation_no">"بررسی خواهم کرد"</string>
-
-    <!-- Fuzzy -->
     <string name="quest_generic_error_field_empty">"شما این قسمت را خالی گذاشته‌اید"</string>
-
-    <!-- Fuzzy -->
     <string name="quest_leave_new_note_title">"در عوض یک یاداشت می‌گذارید؟"</string>
 
     <!-- بهتر نیست به جای نقشه بردار نقشه کش یا یه عبارت دیگه به کار ببریم؟ به نظرم با توجه به معنی اصلی کلمه در اینجا مناسب نباشه -->
@@ -1816,6 +1810,9 @@
     <!-- Fuzzy -->
     <string name="quest_ref_answer_noRef">"بدون شماره پستی قابل مشاهده است ..."</string>
 
+    <!-- Fuzzy -->
+    <string name="quest_street_side_puzzle_tutorial">"جاده در روی تصویر حول محل سنجاق در نقشه چرخانده شده است."</string>
+
     <!-- Fuzzy -->
     <string name="quest_recycling_materials_title">"چه موادی را می‌توان در اینجا برای بازیافت قرار داد؟"</string>
 
@@ -2262,5 +2259,29 @@
     <string name="quest_surface_detailed_square_name_title">"چه جنس سطح مشخصی در میدان %s وجود دارد؟"</string>
     <string name="quest_surface_detailed_title">"جنس سطح این قسمت از جاده چیست؟"</string>
     <string name="quest_surface_detailed_square_title">"جنس سطح این میدان چیست؟"</string>
+    <string name="quest_streetName_menuItem_language_with_script_simple">"%1$s – %2$s, %3$s"</string>
+    <string name="quest_streetName_menuItem_language_with_script_native">"%1$s – %2$s (%3$s), %4$s"</string>
+    <string name="quest_streetName_menuItem_international">"بین‌المللی"</string>
+    <string name="quest_streetName_menuItem_romanized">"به لاتین"</string>
+    <string name="quest_buildingType_terrace2">"خانه‌های ردیفی"</string>
+    <string name="quest_oneway_tutorial">"جاده در تصویر همانند یک نقشه در مکان سنجاق چرخانده شده است. به جهت مشخص شده توجه کنید."</string>
+    <string name="at_housename">"نام خانه %s:"</string>
+    <string name="at_conscription_and_street_number">"شماره خدمات وظیفه %1$s, شماره جهت‌یابی %2$s:"</string>
+    <string name="at_conscription_number">"شماره خدمات وظیفه %s:"</string>
+    <string name="at_housenumber">"شماره خانه %s:"</string>
     <string name="quest_openingHours_name_type_title">"ساعت شروع کار %s چیست؟"</string>
+    <string name="quest_openingHours_resurvey_name_title">"آیا ساعات کاری در %s همچنان صحیح است؟"</string>
+    <string name="quest_openingHours_resurvey_name_type_title">"آیا ساعات کاری %1$s (%2$s) همچنان تغییر نکرده است؟"</string>
+    <string name="quest_openingHours_resurvey_no_name_title">"آیا این ساعات کاری همچنان درست است (%s)؟"</string>
+    <string name="quest_openingHours_add_off_days">"افزودن روزهای حراج"</string>
+    <string name="quest_openingHours_off_day">"روز حراج"</string>
+    <string name="quest_openingHours_unspecified_range">"مشخص نشده"</string>
+    <string name="quest_cycleway_resurvey_title">"آیا اینجا هنوز خط دوچرخه سواری وجود دارد؟"</string>
+    <string name="quest_wheelchairAccess_name_type_title">"آیا در %1$s (%2$s) صندلی چرخدار قابل استفاده است؟"</string>
+    <string name="pref_title_resurvey_intervals">"فواصل تکرار بررسی"</string>
+    <string name="resurvey_intervals_less_often">"کمتر بپرسید"</string>
+    <string name="resurvey_intervals_default">"پیشفرض"</string>
+    <string name="resurvey_intervals_more_often">"بیشتر اوقات بپرسید"</string>
+    <string name="quest_street_side_puzzle_select">"انتخاب کنید"</string>
+    <string name="quest_accepts_cash_type_title">"آیا %1$s (%2$s) پرداخت نقدی را قبول می کند؟"</string>
 </resources>
\ No newline at end of file
diff --git a/app/src/main/res/values-fa/translation_info.xml b/app/src/main/res/values-fa/translation_info.xml
new file mode 100644
index 00000000000..3ddf070ea2f
--- /dev/null
+++ b/app/src/main/res/values-fa/translation_info.xml
@@ -0,0 +1,4 @@
+<?xml version="1.0" encoding="utf-8"?>
+<resources>
+  <integer name="translation_completeness">99</integer>
+</resources>
diff --git a/app/src/main/res/values-fi/translation_info.xml b/app/src/main/res/values-fi/translation_info.xml
new file mode 100644
index 00000000000..1b5ceecab4f
--- /dev/null
+++ b/app/src/main/res/values-fi/translation_info.xml
@@ -0,0 +1,4 @@
+<?xml version="1.0" encoding="utf-8"?>
+<resources>
+  <integer name="translation_completeness">94</integer>
+</resources>
diff --git a/app/src/main/res/values-fr/strings.xml b/app/src/main/res/values-fr/strings.xml
index 5ae9ac89999..d073cca4dea 100644
--- a/app/src/main/res/values-fr/strings.xml
+++ b/app/src/main/res/values-fr/strings.xml
@@ -1745,6 +1745,8 @@ Découper maintenant ?"</string>
 
     <!-- Fuzzy -->
     <string name="quest_ref_answer_noRef">"Aucun numéro de référence visible …"</string>
+
+    <!-- Fuzzy -->
     <string name="quest_street_side_puzzle_tutorial">"La route de l'illustration est tournée de la même façon que sur la carte, à l'emplacement de la punaise."</string>
 
     <!-- Fuzzy -->
diff --git a/app/src/main/res/values-fr/translation_info.xml b/app/src/main/res/values-fr/translation_info.xml
new file mode 100644
index 00000000000..3ddf070ea2f
--- /dev/null
+++ b/app/src/main/res/values-fr/translation_info.xml
@@ -0,0 +1,4 @@
+<?xml version="1.0" encoding="utf-8"?>
+<resources>
+  <integer name="translation_completeness">99</integer>
+</resources>
diff --git a/app/src/main/res/values-gl/strings.xml b/app/src/main/res/values-gl/strings.xml
index 08926814004..78390ef923a 100644
--- a/app/src/main/res/values-gl/strings.xml
+++ b/app/src/main/res/values-gl/strings.xml
@@ -1858,6 +1858,9 @@ Dividila agora?"</string>
     <!-- Fuzzy -->
     <string name="quest_ref_answer_noRef">"Ningún número de referencia visíbel..."</string>
 
+    <!-- Fuzzy -->
+    <string name="quest_street_side_puzzle_tutorial">"A estrada da ilustración é rotada do mesmo xeito que no mapa na localización do marcador."</string>
+
     <!-- Fuzzy -->
     <string name="quest_recycling_materials_title">"Que se pode depositar para reciclar aquí?"</string>
 
@@ -2344,6 +2347,18 @@ Ten en conta que esta aplicación pregunta polo número de enderezo dun edificio
     <string name="at_conscription_number">"Número de «conscrición» %s:"</string>
     <string name="at_housenumber">"número de edificio %s:"</string>
     <string name="quest_openingHours_name_type_title">"Cales son os horarios da apertura de %1$s (%2$s)?"</string>
+    <string name="quest_openingHours_resurvey_name_title">"Seguen a ser correctos estes horarios de apertura de %s?"</string>
+    <string name="quest_openingHours_resurvey_name_type_title">"Seguen a ser correctos estes horarios de apertura de %1$s (%2$s)?"</string>
+    <string name="quest_openingHours_resurvey_no_name_title">"Seguen a ser correctos estes horarios de apertura (%s)?"</string>
+    <string name="quest_openingHours_add_off_days">"Engadir días pechados"</string>
+    <string name="quest_openingHours_off_day">"Día pechado"</string>
+    <string name="quest_openingHours_unspecified_range">"Sen especificar"</string>
+    <string name="quest_cycleway_resurvey_title">"Segue a ser esta a localización do carril bici?"</string>
     <string name="quest_wheelchairAccess_name_type_title">"Podes acceder cara a %1$s (%2$s) nunha cadeira de rodas?"</string>
+    <string name="pref_title_resurvey_intervals">"Intervalos de revisión"</string>
+    <string name="resurvey_intervals_less_often">"Preguntar menos veces"</string>
+    <string name="resurvey_intervals_default">"Predeterminado"</string>
+    <string name="resurvey_intervals_more_often">"Preguntar máis veces"</string>
+    <string name="quest_street_side_puzzle_select">"Premer para seleccionar"</string>
     <string name="quest_accepts_cash_type_title">"%1$s (%2$s) acepta pagamentos en efectivo?"</string>
 </resources>
\ No newline at end of file
diff --git a/app/src/main/res/values-gl/translation_info.xml b/app/src/main/res/values-gl/translation_info.xml
new file mode 100644
index 00000000000..3ddf070ea2f
--- /dev/null
+++ b/app/src/main/res/values-gl/translation_info.xml
@@ -0,0 +1,4 @@
+<?xml version="1.0" encoding="utf-8"?>
+<resources>
+  <integer name="translation_completeness">99</integer>
+</resources>
diff --git a/app/src/main/res/values-hu/translation_info.xml b/app/src/main/res/values-hu/translation_info.xml
new file mode 100644
index 00000000000..5b0ce213bb3
--- /dev/null
+++ b/app/src/main/res/values-hu/translation_info.xml
@@ -0,0 +1,4 @@
+<?xml version="1.0" encoding="utf-8"?>
+<resources>
+  <integer name="translation_completeness">97</integer>
+</resources>
diff --git a/app/src/main/res/values-in/translation_info.xml b/app/src/main/res/values-in/translation_info.xml
new file mode 100644
index 00000000000..1b5ceecab4f
--- /dev/null
+++ b/app/src/main/res/values-in/translation_info.xml
@@ -0,0 +1,4 @@
+<?xml version="1.0" encoding="utf-8"?>
+<resources>
+  <integer name="translation_completeness">94</integer>
+</resources>
diff --git a/app/src/main/res/values-it/strings.xml b/app/src/main/res/values-it/strings.xml
index 38c1cb02b57..453fb515fc7 100644
--- a/app/src/main/res/values-it/strings.xml
+++ b/app/src/main/res/values-it/strings.xml
@@ -1855,7 +1855,7 @@ Suddividere?"</string>
     <string name="quest_ref_answer_noRef">"Nessun numero di matricola visibile..."</string>
 
     <!-- Fuzzy -->
-    <string name="quest_street_side_puzzle_tutorial">"La strada nell'illustrazione è ruotata come sulla mappa alla posizione della puntina. "</string>
+    <string name="quest_street_side_puzzle_tutorial">"La strada nell'illustrazione è ruotata come sulla mappa alla posizione della puntina."</string>
 
     <!-- Fuzzy -->
     <string name="quest_recycling_materials_title">"Cosa può essere lasciato qui per la raccolta differenziata?"</string>
@@ -2344,6 +2344,18 @@ riconoscimento"</string>
     <string name="at_conscription_number">"Numero di coscrizione %s:"</string>
     <string name="at_housenumber">"numero civico %s:"</string>
     <string name="quest_openingHours_name_type_title">"Quali sono gli orari di apertura di %1$s (%2$s)?"</string>
+    <string name="quest_openingHours_resurvey_name_title">"L'orario di apertura di %s è sempre corretto?"</string>
+    <string name="quest_openingHours_resurvey_name_type_title">"L'orario di apertura di %1$s (%2$s) è sempre corretto?"</string>
+    <string name="quest_openingHours_resurvey_no_name_title">"L'orario di apertura è sempre corretto (%s)?"</string>
+    <string name="quest_openingHours_add_off_days">"Aggiungi i giorni di riposo"</string>
+    <string name="quest_openingHours_off_day">"Giorno di riposo"</string>
+    <string name="quest_openingHours_unspecified_range">"Non specificato"</string>
+    <string name="quest_cycleway_resurvey_title">"La situazione della ciclabile qui è sempre la stessa?"</string>
     <string name="quest_wheelchairAccess_name_type_title">"%1$s (%2$s) è accessibile con la sedia a rotelle?"</string>
+    <string name="pref_title_resurvey_intervals">"Intervalli di controllo"</string>
+    <string name="resurvey_intervals_less_often">"Chiedi meno spesso"</string>
+    <string name="resurvey_intervals_default">"Predefinito"</string>
+    <string name="resurvey_intervals_more_often">"Chiedi più spesso"</string>
+    <string name="quest_street_side_puzzle_select">"Premi per selezionare"</string>
     <string name="quest_accepts_cash_type_title">"%1$s (%2$s) accetta pagamenti in denaro?"</string>
 </resources>
\ No newline at end of file
diff --git a/app/src/main/res/values-it/translation_info.xml b/app/src/main/res/values-it/translation_info.xml
new file mode 100644
index 00000000000..3ddf070ea2f
--- /dev/null
+++ b/app/src/main/res/values-it/translation_info.xml
@@ -0,0 +1,4 @@
+<?xml version="1.0" encoding="utf-8"?>
+<resources>
+  <integer name="translation_completeness">99</integer>
+</resources>
diff --git a/app/src/main/res/values-ja/translation_info.xml b/app/src/main/res/values-ja/translation_info.xml
new file mode 100644
index 00000000000..2870f63b74c
--- /dev/null
+++ b/app/src/main/res/values-ja/translation_info.xml
@@ -0,0 +1,4 @@
+<?xml version="1.0" encoding="utf-8"?>
+<resources>
+  <integer name="translation_completeness">71</integer>
+</resources>
diff --git a/app/src/main/res/values-kn/translation_info.xml b/app/src/main/res/values-kn/translation_info.xml
new file mode 100644
index 00000000000..cc69aa0b944
--- /dev/null
+++ b/app/src/main/res/values-kn/translation_info.xml
@@ -0,0 +1,4 @@
+<?xml version="1.0" encoding="utf-8"?>
+<resources>
+  <integer name="translation_completeness">1</integer>
+</resources>
diff --git a/app/src/main/res/values-ko/translation_info.xml b/app/src/main/res/values-ko/translation_info.xml
new file mode 100644
index 00000000000..978d30bb9d0
--- /dev/null
+++ b/app/src/main/res/values-ko/translation_info.xml
@@ -0,0 +1,4 @@
+<?xml version="1.0" encoding="utf-8"?>
+<resources>
+  <integer name="translation_completeness">79</integer>
+</resources>
diff --git a/app/src/main/res/values-ku/translation_info.xml b/app/src/main/res/values-ku/translation_info.xml
new file mode 100644
index 00000000000..df805fd4180
--- /dev/null
+++ b/app/src/main/res/values-ku/translation_info.xml
@@ -0,0 +1,4 @@
+<?xml version="1.0" encoding="utf-8"?>
+<resources>
+  <integer name="translation_completeness">8</integer>
+</resources>
diff --git a/app/src/main/res/values-lb/translation_info.xml b/app/src/main/res/values-lb/translation_info.xml
new file mode 100644
index 00000000000..f8fb0f55e35
--- /dev/null
+++ b/app/src/main/res/values-lb/translation_info.xml
@@ -0,0 +1,4 @@
+<?xml version="1.0" encoding="utf-8"?>
+<resources>
+  <integer name="translation_completeness">16</integer>
+</resources>
diff --git a/app/src/main/res/values-lt/translation_info.xml b/app/src/main/res/values-lt/translation_info.xml
new file mode 100644
index 00000000000..695f1ce1ee6
--- /dev/null
+++ b/app/src/main/res/values-lt/translation_info.xml
@@ -0,0 +1,4 @@
+<?xml version="1.0" encoding="utf-8"?>
+<resources>
+  <integer name="translation_completeness">92</integer>
+</resources>
diff --git a/app/src/main/res/values-lv/translation_info.xml b/app/src/main/res/values-lv/translation_info.xml
new file mode 100644
index 00000000000..fcca1b15c5c
--- /dev/null
+++ b/app/src/main/res/values-lv/translation_info.xml
@@ -0,0 +1,4 @@
+<?xml version="1.0" encoding="utf-8"?>
+<resources>
+  <integer name="translation_completeness">7</integer>
+</resources>
diff --git a/app/src/main/res/values-ml/translation_info.xml b/app/src/main/res/values-ml/translation_info.xml
new file mode 100644
index 00000000000..c5c5d3a62e8
--- /dev/null
+++ b/app/src/main/res/values-ml/translation_info.xml
@@ -0,0 +1,4 @@
+<?xml version="1.0" encoding="utf-8"?>
+<resources>
+  <integer name="translation_completeness">78</integer>
+</resources>
diff --git a/app/src/main/res/values-nb/translation_info.xml b/app/src/main/res/values-nb/translation_info.xml
new file mode 100644
index 00000000000..695f1ce1ee6
--- /dev/null
+++ b/app/src/main/res/values-nb/translation_info.xml
@@ -0,0 +1,4 @@
+<?xml version="1.0" encoding="utf-8"?>
+<resources>
+  <integer name="translation_completeness">92</integer>
+</resources>
diff --git a/app/src/main/res/values-nl/translation_info.xml b/app/src/main/res/values-nl/translation_info.xml
new file mode 100644
index 00000000000..5b0ce213bb3
--- /dev/null
+++ b/app/src/main/res/values-nl/translation_info.xml
@@ -0,0 +1,4 @@
+<?xml version="1.0" encoding="utf-8"?>
+<resources>
+  <integer name="translation_completeness">97</integer>
+</resources>
diff --git a/app/src/main/res/values-nn/translation_info.xml b/app/src/main/res/values-nn/translation_info.xml
new file mode 100644
index 00000000000..695f1ce1ee6
--- /dev/null
+++ b/app/src/main/res/values-nn/translation_info.xml
@@ -0,0 +1,4 @@
+<?xml version="1.0" encoding="utf-8"?>
+<resources>
+  <integer name="translation_completeness">92</integer>
+</resources>
diff --git a/app/src/main/res/values-no/translation_info.xml b/app/src/main/res/values-no/translation_info.xml
new file mode 100644
index 00000000000..695f1ce1ee6
--- /dev/null
+++ b/app/src/main/res/values-no/translation_info.xml
@@ -0,0 +1,4 @@
+<?xml version="1.0" encoding="utf-8"?>
+<resources>
+  <integer name="translation_completeness">92</integer>
+</resources>
diff --git a/app/src/main/res/values-pl/strings.xml b/app/src/main/res/values-pl/strings.xml
index 79027202d50..a00166e07b7 100644
--- a/app/src/main/res/values-pl/strings.xml
+++ b/app/src/main/res/values-pl/strings.xml
@@ -338,7 +338,7 @@ Niemniej przed każdym wysłaniem zmian aplikacja sprawdza &lt;a href=\"https://
     <string name="quest_surface_value_gravel">"żwirowa"</string>
 
     <!-- Fuzzy -->
-    <string name="quest_surface_value_paving_stones">"brukowa"</string>
+    <string name="quest_surface_value_paving_stones">"brukowa / płyta chodnikowa"</string>
 
     <!-- Fuzzy -->
     <string name="quest_surface_value_pebblestone">"otoczaki"</string>
@@ -1855,6 +1855,9 @@ Podzielić?"</string>
     <!-- Fuzzy -->
     <string name="quest_ref_answer_noRef">"Nie ma widocznego numeru..."</string>
 
+    <!-- Fuzzy -->
+    <string name="quest_street_side_puzzle_tutorial">"Droga na ilustracji jest obrócona w ten sam sposób jak odcinek na mapie pod znaczkiem zadania."</string>
+
     <!-- Fuzzy -->
     <string name="quest_recycling_materials_title">"Co można tu zostawić do recyklingu?"</string>
 
@@ -2307,8 +2310,31 @@ Pamiętaj, że ta aplikacja pyta o numer budynku tylko po tym, jak zostanie okre
     <string name="link_qwant_maps_description">"Mapa umożliwiająca wyszukiwanie miejsc i tras"</string>
     <string name="privacy_html_tileserver2">"&lt;p&gt;By wyświetlić mapę przygotowane dane pobierane są z %1$s. Zobacz ich &lt;a href=\"%2$s\"&gt;politykę prywatności&lt;/a&gt; by uzyskać pełne informacje.&lt;/p&gt;"</string>
     <string name="about_title_sponsors">"Sponsorzy"</string>
+    <string name="quest_board_type_history">"Historia"</string>
+    <string name="quest_board_type_geology">"Geologia"</string>
+    <string name="quest_board_type_plants">"Rośliny"</string>
+    <string name="quest_board_type_wildlife">"Dzikie zwierzęta i rośliny"</string>
+    <string name="quest_board_type_nature">"Natura (wiele tematów)"</string>
+    <string name="quest_board_type_notice_board">"To jest tablica z ogłoszeniami"</string>
+    <string name="quest_board_type_public_transport">"Transport publiczny"</string>
+    <string name="quest_board_type_title">"Jaki jest temat tej tablicy informacyjnej"</string>
+    <string name="quest_sidewalk_separately_mapped">"Tak, pokazany osobno na mapie"</string>
+    <string name="quest_board_type_map">"To jest mapa"</string>
+    <string name="quest_board_type_map_title">"Czy to jest mapa i tylko mapa?"</string>
+    <string name="quest_board_type_map_description">"Jeśli tablica jest o konkretnym temacie, wybierz go - niezależnie od tego czy pojawia się też mapa. Na przykład tablica o transporcie publicznym może zawierać też mapę tras autobusowych. Jeśli temat nie jest na liście możliwych odpowiedzi, wybierz raczej \"odpowiedź niemożliwa\" i zostaw notatkę."</string>
+    <string name="quest_surface_detailed_answer_impossible">"Różne nawierzchnie..."</string>
+    <string name="quest_surface_detailed_answer_impossible_confirmation">"Czy jesteś pewien że nie jest możliwe podanie nawierzchni? Zauważ że jest opcja \"Zmienia się\" która pozwala na podzielenie na odcinki z różną nawierzchnią. Wybierz \"Odpowiedź niemozliwa\" jeśli jest jedna nawierzchnia która nie jest możliwa do wybrania jako odpowiedź."</string>
+    <string name="quest_surface_detailed_answer_impossible_description">"Proszę krótko opisz nawierzchnię, na przykład \"piaszczysta z fragmentami kocich łbów\" (jeśli możesz, możesz użyć angielskiego, np \"sandy with patches of cobblestone\"). Długość tekstu ograniczona jest do 255 znaków."</string>
+    <string name="quest_surface_detailed_name_title">"Jaki jest dokładny rodzaj nawierzchni drogi %s w tym miejscu?"</string>
+    <string name="quest_surface_detailed_square_name_title">"Jaki jest dokładny rodzaj nawierzchni placu %s w tym miejscu?"</string>
+    <string name="quest_surface_detailed_title">"Jaki jest dokładny rodzaj nawierzchni drogi w tym miejscu?"</string>
+    <string name="quest_surface_detailed_square_title">"Jaki jest dokładny rodzaj nawierzchni placu w tym miejscu?"</string>
     <string name="quest_streetName_menuItem_language_with_script_simple">"%1$s – %2$s, %3$s"</string>
     <string name="quest_streetName_menuItem_language_with_script_native">"%1$s – %2$s (%3$s), %4$s"</string>
+    <string name="quest_streetName_menuItem_international">"międzynarodowa"</string>
+    <string name="quest_streetName_menuItem_romanized">"w piśmie łacińskim"</string>
+    <string name="quest_buildingType_terrace2">"wiele domów szeregowych"</string>
+    <string name="quest_oneway_tutorial">"Droga na ilustracji jest obrócona w ten sam sposób jak odcinek na mapie pod znaczkiem zadania. Zwróć uwagę na zaznaczony kierunek. "</string>
     <string name="at_housename">"Nazwa budynku %s:"</string>
     <string name="at_conscription_and_street_number">"Numer konskrypcyjny %1$s, numer orientacyjny %2$s:"</string>
 
@@ -2316,6 +2342,25 @@ Pamiętaj, że ta aplikacja pyta o numer budynku tylko po tym, jak zostanie okre
     <string name="at_conscription_number">"Numer konskrypcyjny %s:"</string>
     <string name="at_housenumber">"Numer domu %s:"</string>
     <string name="quest_openingHours_name_type_title">"Jakie są godziny otwarcia %1$s (%2$s)?"</string>
+    <string name="quest_openingHours_resurvey_name_title">"Czy te godziny otwarcia dla %s są dalej aktualne?"</string>
+    <string name="quest_openingHours_resurvey_name_type_title">"Czy te godziny otwarcia dla %1$s (%2$s) są dalej aktualne?"</string>
+    <string name="quest_openingHours_resurvey_no_name_title">"Czy te godziny otwarcia są dalej aktualne (%s)?"</string>
+    <string name="quest_openingHours_add_off_days">"Dodaj dni gdy jest zamknięte"</string>
+    <string name="quest_openingHours_off_day">"Zamknięte"</string>
+    <string name="quest_openingHours_unspecified_range">"Nie podano"</string>
+    <string name="quest_cycleway_resurvey_title">"Czy stan ścieżki rowerowej się zmienił?"</string>
     <string name="quest_wheelchairAccess_name_type_title">"Czy %1$s (%2$s) jest dostępne dla osób na wózku inwalidzkim?"</string>
+    <string name="pref_title_resurvey_intervals">"Jak często weryfikować dane?"</string>
+    <string name="resurvey_intervals_less_often">"Pytaj rzadziej"</string>
+    <string name="resurvey_intervals_default">"Domyślny"</string>
+    <string name="resurvey_intervals_more_often">"Pytaj częściej"</string>
+    <string name="quest_street_side_puzzle_select">"Dotknij by wybrać"</string>
     <string name="quest_accepts_cash_type_title">"Czy %1$s (%2$s) akceptuje płatność gotówką?"</string>
+    <string name="quest_busStopBench_tram_name_title">"Czy przystanek tramwajowy %s ma miejsce do siedzenia?"</string>
+    <string name="quest_busStopBench_tram_title">"Czy ten przystanek tramwajowy ma miejsce do siedzenia?"</string>
+    <string name="quest_busStopBench_title">"Czy ten przystanek autonusowy ma miejsce do siedzenia?"</string>
+    <string name="quest_busStopBench_name_title">"Czy przystanek autobusowy %s ma miejsce do siedzenia?"</string>
+    <string name="quest_summit_register_title">"Czy szczyt %s ma księgę gości?"</string>
+    <string name="quest_is_defibrillator_inside_title">"Czy ten defibrylator (AED) jest wewnątrz budynku?"</string>
+    <string name="dialog_tutorial_download">"Z wyłączoną autosynchronizacją zadania nie są automatycznie pobrane. By to zrobić przesuń mapę do interesującej cię lokalizacji i użyj przycisku \"%s\" w menu."</string>
 </resources>
\ No newline at end of file
diff --git a/app/src/main/res/values-pl/translation_info.xml b/app/src/main/res/values-pl/translation_info.xml
new file mode 100644
index 00000000000..1953c600c12
--- /dev/null
+++ b/app/src/main/res/values-pl/translation_info.xml
@@ -0,0 +1,4 @@
+<?xml version="1.0" encoding="utf-8"?>
+<resources>
+  <integer name="translation_completeness">100</integer>
+</resources>
diff --git a/app/src/main/res/values-pt-rBR/strings.xml b/app/src/main/res/values-pt-rBR/strings.xml
index 66af21cac5c..a3f2ba0cb48 100644
--- a/app/src/main/res/values-pt-rBR/strings.xml
+++ b/app/src/main/res/values-pt-rBR/strings.xml
@@ -2109,5 +2109,6 @@ Observe que este aplicativo solicita o número da casa de uma construção somen
     <string name="at_housenumber">"número da casa %s:"</string>
     <string name="quest_openingHours_name_type_title">"Quais são os horários de funcionamento de %1$s (%2$s)?"</string>
     <string name="quest_wheelchairAccess_name_type_title">"%1$s (%2$s) é acessível por cadeiras de rodas?"</string>
+    <string name="resurvey_intervals_default">"Padrão"</string>
     <string name="quest_accepts_cash_type_title">"%1$s (%2$s) aceita pagamento em dinheiro?"</string>
 </resources>
\ No newline at end of file
diff --git a/app/src/main/res/values-pt-rBR/translation_info.xml b/app/src/main/res/values-pt-rBR/translation_info.xml
new file mode 100644
index 00000000000..5b0ce213bb3
--- /dev/null
+++ b/app/src/main/res/values-pt-rBR/translation_info.xml
@@ -0,0 +1,4 @@
+<?xml version="1.0" encoding="utf-8"?>
+<resources>
+  <integer name="translation_completeness">97</integer>
+</resources>
diff --git a/app/src/main/res/values-pt/translation_info.xml b/app/src/main/res/values-pt/translation_info.xml
new file mode 100644
index 00000000000..87f2b5d688b
--- /dev/null
+++ b/app/src/main/res/values-pt/translation_info.xml
@@ -0,0 +1,4 @@
+<?xml version="1.0" encoding="utf-8"?>
+<resources>
+  <integer name="translation_completeness">75</integer>
+</resources>
diff --git a/app/src/main/res/values-ro/translation_info.xml b/app/src/main/res/values-ro/translation_info.xml
new file mode 100644
index 00000000000..1382aea1481
--- /dev/null
+++ b/app/src/main/res/values-ro/translation_info.xml
@@ -0,0 +1,4 @@
+<?xml version="1.0" encoding="utf-8"?>
+<resources>
+  <integer name="translation_completeness">15</integer>
+</resources>
diff --git a/app/src/main/res/values-ru/strings.xml b/app/src/main/res/values-ru/strings.xml
index 3770480242c..f749f867478 100644
--- a/app/src/main/res/values-ru/strings.xml
+++ b/app/src/main/res/values-ru/strings.xml
@@ -2280,6 +2280,7 @@
     <string name="quest_streetName_menuItem_language_with_script_native">"%1$s – %2$s (%3$s), %4$s"</string>
     <string name="quest_streetName_menuItem_international">"международное"</string>
     <string name="quest_streetName_menuItem_romanized">"Латиницей"</string>
+    <string name="quest_buildingType_terrace2">"Ряд домов"</string>
     <string name="at_housename">"Название дома %s:"</string>
     <string name="at_conscription_and_street_number">"Сквозная нумерация %1$s, Ориентировочный номер %2$s:"</string>
 
@@ -2288,5 +2289,6 @@
     <string name="at_housenumber">"номер дома %s:"</string>
     <string name="quest_openingHours_name_type_title">"Какое время работы у %1$s (%2$s)?"</string>
     <string name="quest_wheelchairAccess_name_type_title">"Доступно ли %1$s (%2$s) для инвалидных колясок?"</string>
+    <string name="resurvey_intervals_default">"По умолчанию"</string>
     <string name="quest_accepts_cash_type_title">"Принимают ли в %1$s (%2$s) оплату наличными?"</string>
 </resources>
\ No newline at end of file
diff --git a/app/src/main/res/values-ru/translation_info.xml b/app/src/main/res/values-ru/translation_info.xml
new file mode 100644
index 00000000000..1b5ceecab4f
--- /dev/null
+++ b/app/src/main/res/values-ru/translation_info.xml
@@ -0,0 +1,4 @@
+<?xml version="1.0" encoding="utf-8"?>
+<resources>
+  <integer name="translation_completeness">94</integer>
+</resources>
diff --git a/app/src/main/res/values-sk/translation_info.xml b/app/src/main/res/values-sk/translation_info.xml
new file mode 100644
index 00000000000..754cab7b61d
--- /dev/null
+++ b/app/src/main/res/values-sk/translation_info.xml
@@ -0,0 +1,4 @@
+<?xml version="1.0" encoding="utf-8"?>
+<resources>
+  <integer name="translation_completeness">70</integer>
+</resources>
diff --git a/app/src/main/res/values-sl/translation_info.xml b/app/src/main/res/values-sl/translation_info.xml
new file mode 100644
index 00000000000..b1cd140a303
--- /dev/null
+++ b/app/src/main/res/values-sl/translation_info.xml
@@ -0,0 +1,4 @@
+<?xml version="1.0" encoding="utf-8"?>
+<resources>
+  <integer name="translation_completeness">58</integer>
+</resources>
diff --git a/app/src/main/res/values-sq/translation_info.xml b/app/src/main/res/values-sq/translation_info.xml
new file mode 100644
index 00000000000..8b6736894e3
--- /dev/null
+++ b/app/src/main/res/values-sq/translation_info.xml
@@ -0,0 +1,4 @@
+<?xml version="1.0" encoding="utf-8"?>
+<resources>
+  <integer name="translation_completeness">52</integer>
+</resources>
diff --git a/app/src/main/res/values-sv/translation_info.xml b/app/src/main/res/values-sv/translation_info.xml
new file mode 100644
index 00000000000..5b0ce213bb3
--- /dev/null
+++ b/app/src/main/res/values-sv/translation_info.xml
@@ -0,0 +1,4 @@
+<?xml version="1.0" encoding="utf-8"?>
+<resources>
+  <integer name="translation_completeness">97</integer>
+</resources>
diff --git a/app/src/main/res/values-ta/translation_info.xml b/app/src/main/res/values-ta/translation_info.xml
new file mode 100644
index 00000000000..7f12ca510a5
--- /dev/null
+++ b/app/src/main/res/values-ta/translation_info.xml
@@ -0,0 +1,4 @@
+<?xml version="1.0" encoding="utf-8"?>
+<resources>
+  <integer name="translation_completeness">23</integer>
+</resources>
diff --git a/app/src/main/res/values-tr/translation_info.xml b/app/src/main/res/values-tr/translation_info.xml
new file mode 100644
index 00000000000..36c2b1735e4
--- /dev/null
+++ b/app/src/main/res/values-tr/translation_info.xml
@@ -0,0 +1,4 @@
+<?xml version="1.0" encoding="utf-8"?>
+<resources>
+  <integer name="translation_completeness">73</integer>
+</resources>
diff --git a/app/src/main/res/values-ug/translation_info.xml b/app/src/main/res/values-ug/translation_info.xml
new file mode 100644
index 00000000000..f975a8d055e
--- /dev/null
+++ b/app/src/main/res/values-ug/translation_info.xml
@@ -0,0 +1,4 @@
+<?xml version="1.0" encoding="utf-8"?>
+<resources>
+  <integer name="translation_completeness">0</integer>
+</resources>
diff --git a/app/src/main/res/values-uk/translation_info.xml b/app/src/main/res/values-uk/translation_info.xml
new file mode 100644
index 00000000000..a40757c789a
--- /dev/null
+++ b/app/src/main/res/values-uk/translation_info.xml
@@ -0,0 +1,4 @@
+<?xml version="1.0" encoding="utf-8"?>
+<resources>
+  <integer name="translation_completeness">66</integer>
+</resources>
diff --git a/app/src/main/res/values-vi/translation_info.xml b/app/src/main/res/values-vi/translation_info.xml
new file mode 100644
index 00000000000..4cbfd1cfe61
--- /dev/null
+++ b/app/src/main/res/values-vi/translation_info.xml
@@ -0,0 +1,4 @@
+<?xml version="1.0" encoding="utf-8"?>
+<resources>
+  <integer name="translation_completeness">49</integer>
+</resources>
diff --git a/app/src/main/res/values-zh-rTW/translation_info.xml b/app/src/main/res/values-zh-rTW/translation_info.xml
new file mode 100644
index 00000000000..5b0ce213bb3
--- /dev/null
+++ b/app/src/main/res/values-zh-rTW/translation_info.xml
@@ -0,0 +1,4 @@
+<?xml version="1.0" encoding="utf-8"?>
+<resources>
+  <integer name="translation_completeness">97</integer>
+</resources>
diff --git a/app/src/main/res/values-zh/translation_info.xml b/app/src/main/res/values-zh/translation_info.xml
new file mode 100644
index 00000000000..7a38a0aae96
--- /dev/null
+++ b/app/src/main/res/values-zh/translation_info.xml
@@ -0,0 +1,4 @@
+<?xml version="1.0" encoding="utf-8"?>
+<resources>
+  <integer name="translation_completeness">77</integer>
+</resources>
diff --git a/app/src/main/res/values/strings.xml b/app/src/main/res/values/strings.xml
index 279fd95f5ba..914bad6b268 100644
--- a/app/src/main/res/values/strings.xml
+++ b/app/src/main/res/values/strings.xml
@@ -777,6 +777,8 @@ Otherwise, you can download another keyboard in the app store. Popular keyboards
     <string name="about_title_rate">Rate this app</string>
     <string name="about_summary_rate">on Google Play</string>
     <string name="about_title_donate">Donate</string>
+    <string name="about_title_translate">Help translate this app</string>
+    <string name="about_description_translate">%1$s is translated %2$d%%</string>
     <string name="about_title_sponsors">Sponsors</string>
     <string name="about_summary_donate">Show your appreciation! ❤️</string>
     <string name="about_description_donate">Thank you for considering to support this app! To see current donations and to donate yourself, tap on the respective platform:</string>
diff --git a/app/src/main/res/values/translation_info.xml b/app/src/main/res/values/translation_info.xml
new file mode 100644
index 00000000000..f975a8d055e
--- /dev/null
+++ b/app/src/main/res/values/translation_info.xml
@@ -0,0 +1,4 @@
+<?xml version="1.0" encoding="utf-8"?>
+<resources>
+  <integer name="translation_completeness">0</integer>
+</resources>
diff --git a/app/src/main/res/xml/about.xml b/app/src/main/res/xml/about.xml
index a19190d4f91..7bbb02adb71 100644
--- a/app/src/main/res/xml/about.xml
+++ b/app/src/main/res/xml/about.xml
@@ -18,6 +18,11 @@
         android:summary="@string/about_summary_donate"
         />
 
+    <Preference
+        android:key="translate"
+        android:title="@string/about_title_translate"
+        android:widgetLayout="@layout/widget_image_open_in_browser" />
+
     <Preference
         android:key="license"
         android:title="@string/about_title_license"
